,Query,Top-1,Top-2,Top-3,Top-4,Top-5
125,morning paper lay fontaine sunkpg 149 deep armchair picture misery,marsac throw chair groan aloud fontaine alone although pretend grieve felt perfectly will get rid madame fleury price even present withpg 145 prospective fatherinlaw chargerafter manner herodias another enterprising wouldbe widow good many years ago,room shabby ever fontaine dress height although still deepest mourn,fontaine lay sofa groan kick occasionally sigh name claire duval,old duval exclaim fontaine drop limp chair first sound voice,fontaine drop limp upon pg 41 chair sit bury arm picture misery
126,without word fontaine marsacs help put even suit topcoat crapecovered hat black gloves,think complete counterfeit apparatus produce sum franc moments notice say fontaine ruefully would willingly give pair shoe marsac would accept dont know,marsac spend day patch clean awkward industry fontaines tear coat trousers,lay several suit handsomest mourn clothe imaginable hat gloves match top everything pin letter,marsac shoe clothe choose accept proposition monsieur fontaine coolly interrupt madame fleury put street within twentyfour hours reach street arrest nonpayment rent go street without coat trousers shall certainlypg 37 arrest answer fontaine desperately,great fool marsac hand fontaines crapecovered hat
127,people start website main pg search facility www website include information project gutenberg include make donations project gutenberg literary archive foundation help produce new ebooks subscribe email newsletter hear new ebooks,may copy give away reuse term project gutenberg license include ebook online www locate unite state check laws country locate use ebook,may copy give away reuse term project gutenberg license include ebook online www locate unite state check laws country locate use ebook,information donations project gutenberg literary archive foundation project gutenberg depend upon cannot survive without widespread public support donations carry mission increase number public domain license work freely distribute machinereadable form accessible widest array equipment include outdated equipment,forty years produce distribute project gutenberg ebooks loose network volunteer support,title sprightly romance marsac author molly elliot seawell illustrator gustave verbeek release date february 27 2025 ebook language english original publication new york charles scribners sons 1896 credit online distribute proofread team httpswww file produce image generously make available internet archive start project gutenberg ebook sprightly romance marsac extravagant bread ask marsac cheerfully work away old screen
128,take cheque bind bargain fontaine could scarcely refrain embrace editor spot butpg 110 obey telegraphic signal marsac merely say inconvenience slightest please wife know settle answer maurepas take chequebook rapidly write cheque twenty thousand francs,tell would delight know moment revel rapture rather singular manner show indeed say madame fleury vain enough think merely suddenness affair somewhat disconcert fontaine almost drag chair marsac sullenly sign thepg 42 paper take possession recommend act good faith madame fleury depart air person make successful stroke business,pg ix list illustrations page extravagant bread ask marsac cheerfully work away old screen frontispiece madame schmid plainly rage 2 madame schmid grow still redder face shorter breath 5 easy enough see master mind 9 madame fleury enter 17 ever think marriage way trouble 25 marsac advance fontaine whisper ear 37 marsac take hand lead madame fleury 39 bold stroke bullfighter assume appearance hale old gentleman sixty 48 pg x fell chair amazement chagrin 50 two young men tear open box 53 hug begin dance wildly 56 dont speak fiance disrespectful manner cry marsac 65 open without word take four bottle champagne 67 saw two poor creatures stand front pastryshop 68 marsac receive much kindness respect bankers daughters 75 madame schmid make dash fontaine collar drag 77 villa say old brewer 83 monsieur duval kneel 89 monsieur duval close one eye playfully poke rib 93 door open admit fontaine two remarkably pretty girls 97 pg xi young people talk gaily together sip champagne 100 hundred thirty thousand francs cry maurepas 108 marsac turn double handspring sofa 110 marsac seize around waist begin waltz furiously 113 creep softly apartment 115 bring delphines golden quite close marsacs brown one consent willingly 121 oh madame fleury cry marsac actually hang 129 madame fleury press handkerchief eye 132 marsac could scarcely restrain shout joy 137 madame fleury begin eagerly search grind letter 139 marsac say tear paper half fontaine dear claire 143 monsieur duvals victoria madame fleury 145 pg xii fontaine sink deep armchair picture misery 149 little old man clutch rusty travellingbag tremble hand 151 let assist say fontaine try take old bag 159 marsac delphine leave alone 161 madame fleury stand petrify moment 175 thing trust say fontaine 177 walk one weazened cadaverous little men ever step 180 madame fleury rush drag unhappy fleury 188 marsac arm around delphines waist 194 pg xiii sprightly romance marsac pg 1 sprightly romance marsac1 1 dramatic right reserve,letter prince de landais take landaiss billi assure neither us know man except business wayand write want fontaine marry daughter actually ask money advanceabout six hundred seventyfive francsand take tone person already entitle wretched aristocratic pauper cry old duval indignantly,madame fleury marsacs embarrassment lose although new woman still woman womanly pride impel control slight tremor nerve say voice studiedly cold mere matter business convenience pg 31 give marsac think loophole escape say hurriedly madame innocence regard marriage matter sentiment imagine chagrin though madame fleury smile blush like girl reply well monsieur marsac marsac saw moment pit dig prefer play part poltroon step,dont know pay give hundred thousand francs prospect make clear ten thousand francs delight fontaine could speak momentwhen catch marsacs eye fix upon understand signal give evasive answer whichpg 107 maurepas poohpoohed
129,dare say claire ask auguste question eve ask adam garden edenis woman ever love occur marsac would well prepare delphine fontaine actually reveal moment draw chair nearer say confidentially mademoiselle tell exactly talk moment 163 would think tell fontaines uncle maurice dead arrive lodgings soon present room delphines mouth come open astonishment first question recover shock surprise fortune marsac shake lugubriously,trust get fontaine delight find marsac crazy could nothing hug say marsac frighten begin talk may kill uncles aunts find kill,monsieur fontaine oblige tell porter direct wait awhile case quite ready go monsieur duval object get fontaine way moment door close upon draw chair marsacs begin seriously mop forehead anxiety know monsieur marsac always think extremely well monsieur fontaine come snug fortune mind heif daughter herepg 86 monsieur duval wink marsac grin appreciatively,depend upon things go fontaines name remarkable moment footman approach hand marsac card say lady ask monsieur fontaine marsac hand card back happen see madame fleury stop cry instantly give moment think,terrible claire succeed capture monsieur duval pg 164 delphines answer artfully contrive dreadful woman succeed marry uncle could longer home opportunity marsac declare spark tenderness,anyhow monsieur duval talk whole hour afternoon may depend upon stuff result isnow dont go crazythat hint match claire fontaine fell sofa ecstasy murmur dear darling claire come see soon congratulate
130,wish see monsieur fontaine regard engagement us engagement ask marsac innocently,ill take make one condition dear fellow say marsac earnestly fontaine,monsieur fontaine gift young fellow say monsieur duval,like proposition shall meet monsieur duval,marsac know turn thoughts take say slyly meet old duval today fontaine jump shoot,madame fleury bring matter crisis ask smile shall gentlemenan engagement eviction fontaine could bring say word submit silently marsac take hand lead madame fleury place hand together say something dangerously near wink take lovely hand hold
131,besides give fictitious fortune make brilliant man paris tell simply kill try live character,play really vicious enough wife merely give husband opiate escape lover instead drive imperative fate give quart corrosive sublimate,appear public tomorrowyou heir uncle maurice friend nephew uncle think deceive waiter anxiously ask fontaine,trust get fontaine delight find marsac crazy could nothing hug say marsac frighten begin talk may kill uncles aunts find kill,hear dead old gentleman would please find alive would forgive us anything among first persons hear story madame fleury hardest task marsac stop entresol one morning inquiry whether story true fontaines uncles death,would marry monsieur marsac commit suicide even rather live house delphine scarcely conscious say gleam wicked amusement madame fleurys eye show make dangerous slip
132,true come fortune determine contract shall fulfil 15th month,prepare depart house intend preside,additional term link project gutenberg license work post permission copyright holder find begin work,might well add name date fulfilment promise,pg 132 fifteen minutes go marsac turn round glance pair,however story uncle maurice fortune true shall look forward satisfaction ever 15th may
133,marsac felt singular kind acquaintanceship even kinship uncle maurice dim sensation pity poor old man stand hold apparently worldly possessions look deprecate apologetic blankly disappoint,draw noble picture uncle mauricefor look fontaine profit old gentleman least give good character,endow every virtue man gentleman seem clairvoyant uncle maurice laugh excessivelypg 188 hand smaller roll old bag marsac say well would like nephew less kind nephew less obligation hundred thousand francs mere nestegg,marsac declare felt like go mourn grateful uncle maurice do fontaine fontaine perfect truth say think hispg 102 uncle maurice relative world,fontaine extremely honestpg 148 simple nature suffer agonies false reputation embarrass manner sickly smile receive compliment achievements take modesty pass therefore modest well gift young man paris,goodi know good yes yes ill forgive marsac hear old duval answer although forgive could tell save life thousand sham man cause innocent little heart ache
134,fontaine could look marsac without almost feminine expression fondness tender reliance come eye bottom heart think marsac brilliant capable lovable men,come along fontaine never resist marsac life could go obediently drawingroom greet affectionately man whose existence conceive utterly disastrous,marsac regularly handsome fontaine dark bright eye captivate smile seem radiate brilliance round,goodi know good yes yes ill forgive marsac hear old duval answer although forgive could tell save life thousand sham man cause innocent little heart ache,yes reply marsac modestly report dead determine give fontaine every franc fortune give sir good character besides,fontaine extremely honestpg 148 simple nature suffer agonies false reputation embarrass manner sickly smile receive compliment achievements take modesty pass therefore modest well gift young man paris
135,engagement little supper tonight archbishopsquite informal little affair hundred thirty thousand francs cry maurepas,lady quietly remark marsac account story cabinet dinner gout add air finest sarcasm see earthly reason monsieur marsac succeed brilliantly journalism pg 34 marsac quite dispose let fontaine take part situation say word fontaine exclaim know come madame fleury,forget tomorrow dine prince next day marshal day archbishop duval little stagger magnificent name remark think tell today monsieur fontaine go society account mourn coolly respond marsac,tell slip conciergethey minutesand go get wine flower make little feast poor souls fontaine better worse nights work marsac best fellow ever live cry fontaine hug,madame fleury bring matter crisis ask smile shall gentlemenan engagement eviction fontaine could bring say word submit silently marsac take hand lead madame fleury place hand together say something dangerously near wink take lovely hand hold,see go day two think perhaps ill trifle mere trifle answer marsac much readiness littlepg 18 dinner ministerial housethose fellows give one lot champagneand inherit gout give touch pray excuse slippers
136,marsac promptly agree delphine would hold candlewhich would necessary fade light,meanwhile catastrophe indicate first meet marsac delphine fall violent manner,afar dark illumine wax candle look like firefly marsac read plato aloud assent lips contradiction heart,marsac dare propose delphine secure charm society enslave marriage,yes one might lose loveletter hazard marsac,presently marsac light another match drop accident upon little pile piece paper
137,keep way refuse answer letter pursue,never make speech life could,wouldnt,wont listen proposition respect sure one upon another subject,say wont keep secret longer,tell nothing
138,real fact marsac hitherto unappreciated genius rise great occasion offer success charlatan,especially true time great calamity pg 99 yes indeed say marsac energy,marsac whose cheerfulness never leave,fontaine always think marsac cleverest fellow world rank napoleon alexander great,marsac regularly handsome fontaine dark bright eye captivate smile seem radiate brilliance round,delphine felt instant attraction toward marsac bright eye alert look intelligence gentlemanly
139,speechless happiness cry marsac,marsac whose cheerfulness never leave,marsac see dreadful think fontaines mind stop whoop seize fontaine arm cry honest little simpleton,hear roundabout way dead nothing leave anybody likely sigh marsac,joyfully shout fontaine saw acquiescence marsacs eye,tenderness amount adoration marsacthe ready witty glib daringwas silent abash presence masterpassion
140,would worth five thousand francs advertise,fifty francs cry marsac thousand francs,could help translate hundreds thousands say owe tailor nearly seven thousand francs quite seven hundred,shoemaker say three francs shoe two francs five centimes,want buy great hotel avenue de lalma seven hundred fifty thousand francs,give la lune three sign article week thousand word give five hundred francs week
141,afraid marsacs deject reply,plain distress aboutpg 160 something delphines first word great trouble bright us either gloomily reply marsac,afraid smallpox story wont judicious subterfuge fontaines reply,awkward humiliate smallest doubt marsac think capable meet emergency would eventually get scrape,peculiar penetrate although agitate unpleasant love idiot alarm say marsac anxiously,marsac completely unnerve manage hide delphine
142,couldnt youahemthe widownow attractive fellow,claire wretched idea although timid girl dare question father every reason suspect hispg 147 infatuation widow come near wreck fontaines life,think unlikely prospect marry handsome young man far social position might really madame fleurys mind,monsieur fontaine would marry lack something better,help marsac bad grace present widow,infernal widow downstairs dont speak fiance disrespectful manner cry marsac time dodge fontaines new hat fly direction
143,press handkerchief eye almost fell upon old duvals shoulder cry monsieur duval stand see affront madame fleury sturdily answer monsieur duval arm half round waist,presently rise walk marsac stand begin whisper embarrass manner say monsieur marsacpray pardon askingwould youerahbe kind enough tell meexcuse inquire herepg 135 old fellow burst explosively devil stick answer marsac think would like protection presence circumstances welli dont occur suggest make offer madame fleury,least man marry claire worthless fatherinlawpg 88 like prince de landais prey upon letter madame schmid rather baroness schmidmarsac make addition see quickly monsieur duval jump every name,madame fleury could repress cry rage monsieur duval drop arm redhot,wear look jaunty expectation seem increase startle spectacle himmadame fleury hold monsieur duvals arm old man puff blow smile frown alternate spasms rage delight claire cling fontaine great distress delphine pale defiant stand alone centre group,leave hand press handkerchief eye monsieur duval pat right say tenderly dont cry ah one heart one must suffer murmur madame fleury beautiful little sob press lacetrimmed handkerchief eye
144,fontainefoolishly thinkdid confide frankly tell distress confess deception claire,marry heroh think dreadful claire burst tear,would mention fear fontaine soon madame fleury safely hear marsac contrive raise burst rather hollow hysterical laughter,pg 123 monsieur duval sigh fidget burst know afraidi afraid blame let daughter monsieur fontaine see much matter still uncertain comtesse de fleury see two young people deeply love,must confess claire dont believe change affection fontaine time reply moment claire delphine enter room together,think delphine ask claire hand still lie fontainesthis foolish boy fortune know time dare tell
145,saw youngster respect moment maurepas editorinchief ask breakfast next day,marsac advance politely meet two exchange bow pugilists shake hand enter ring,intervals walk wonder marsac late fontainepg 67 would read reread letter evident delight,marsac coolly survey audience announce honour present madame fleurys husband throw door openpg 180 grand flourish walk one weazened cadaverous little men ever step behind madame schmids rubicund countenance rotund,ten minutes informal bind agreement make sign maurepas take departure,door open duvals go say goodbye tenth time two young men saw come stairs compact shrewd face maurepas editorinchief
146,know widow certainly reply marsac,marsac seat reflect moment say 31st april 31st april reply madame fleury,woman marsac love,ladies supper gravely reply marsac,help marsac bad grace present widow,pretty high yes answer marsac remain account widow comtesse de fleury surroundings valuable think perhaps
147,chapter madame schmid round red spotless lappets washerwomans cap flap angrily plainly rage three loud whack give garret door 17 rue montignal cause two young gentlemen side door quake visibly,fellow clever always make way world marsac overwhelm old man generosity silence stand grasp uncle maurices hand break slam door madame fleury rush drag unhappy fleury,great heavens whisper old duval one blame monsieur fontaine run away woman scarcely word mouth madame schmid make lunge door fly open knock monsieur duval sprawl,go bill moan madame schmid wag dolefully landais shake like chinese mandarin,msieu marsac say almost laugh marsacs gloomy face heres person lady please proclaim loud voice madame schmid march shove footman unceremoniously way,pg ix list illustrations page extravagant bread ask marsac cheerfully work away old screen frontispiece madame schmid plainly rage 2 madame schmid grow still redder face shorter breath 5 easy enough see master mind 9 madame fleury enter 17 ever think marriage way trouble 25 marsac advance fontaine whisper ear 37 marsac take hand lead madame fleury 39 bold stroke bullfighter assume appearance hale old gentleman sixty 48 pg x fell chair amazement chagrin 50 two young men tear open box 53 hug begin dance wildly 56 dont speak fiance disrespectful manner cry marsac 65 open without word take four bottle champagne 67 saw two poor creatures stand front pastryshop 68 marsac receive much kindness respect bankers daughters 75 madame schmid make dash fontaine collar drag 77 villa say old brewer 83 monsieur duval kneel 89 monsieur duval close one eye playfully poke rib 93 door open admit fontaine two remarkably pretty girls 97 pg xi young people talk gaily together sip champagne 100 hundred thirty thousand francs cry maurepas 108 marsac turn double handspring sofa 110 marsac seize around waist begin waltz furiously 113 creep softly apartment 115 bring delphines golden quite close marsacs brown one consent willingly 121 oh madame fleury cry marsac actually hang 129 madame fleury press handkerchief eye 132 marsac could scarcely restrain shout joy 137 madame fleury begin eagerly search grind letter 139 marsac say tear paper half fontaine dear claire 143 monsieur duvals victoria madame fleury 145 pg xii fontaine sink deep armchair picture misery 149 little old man clutch rusty travellingbag tremble hand 151 let assist say fontaine try take old bag 159 marsac delphine leave alone 161 madame fleury stand petrify moment 175 thing trust say fontaine 177 walk one weazened cadaverous little men ever step 180 madame fleury rush drag unhappy fleury 188 marsac arm around delphines waist 194 pg xiii sprightly romance marsac pg 1 sprightly romance marsac1 1 dramatic right reserve
148,give shoe fontaine kick marsac put,marsac know turn thoughts take say slyly meet old duval today fontaine jump shoot,send name fontaine aristocratic marsac,monsieur fontaine go,rubicon pass reply fontaine step,fontaine ask franc shoe reply franc
149,conversation turn uncle maurice,besides might true uncle maurice america,eh ask uncle maurice seem sting remark,ha uncle maurice seem tickle idea,uncle maurice,believe uncle maurice
150,see paragraph 1,one,recognise fontaine see,note,listen,see paragraph 1
151,read paper even monsieur maurice fontaines death wouldpg 54 glad supply monsieur auguste fontaines mourn,allow say marsac low bow present ladies gentlemen monsieur maurice fontaine late new york henceforth paris madame fleury seem literally stun sight little old man without notice sensation make appearance go round circle shake hand forget madame fleury gavepg 185 hand like woman nightmare ask little niece claire run look smilingly face say uncle maurice old man gratification touch,marsac declare felt like go mourn grateful uncle maurice do fontaine fontaine perfect truth say think hispg 102 uncle maurice relative world,hear dead old gentleman would please find alive would forgive us anything among first persons hear story madame fleury hardest task marsac stop entresol one morning inquiry whether story true fontaines uncles death,examine parcel carefully fontaine brokenly express thankspg 187 claire kiss old man tear eye,naturally still set story legs begin receive letter condolence mix congratulations force reply paper black border inch deep sign inky sealingwax even begin believe uncle maurice die leave fortune
152,another one widowwho worse pg 91 oh jupiter monsieur duvals exclamation pick floor dust knees elbow,merely say way make things agreeable madame fleury countess madame fleurys reply one word utter tone concentrate hatred wretch thank get restore longlost husbandpg 181 say marsac injure voice,terrible dnouement wreck havoc make old man disappointment touch marsac one best hearts world,cry fontaine desperately dash hand forehead suppose infernal old uncle maurice mine turn america pg 151 say marsac impossible,help marsac bad grace present widow,pick marsac halt eye travel round room fell rusty bellow resume glibly pick pair bellow throw king
153,look solemnhe come waiter come find marsac urge fontaine eat seem depths despondency,soon madame fleury mention offer hand fontaine look marsac suppose either friend go crazy marsacs cool demeanour prove least sane,time come fee man fontaine say sadly marsac must pay tonight,marsac waiters absence beg fontaine spare candelabra fontaine catch marsac act chew paper marrons glacs,forget tomorrow dine prince next day marshal day archbishop duval little stagger magnificent name remark think tell today monsieur fontaine go society account mourn coolly respond marsac,marsac see fontaines gloomy mood begin jovially jauntily say old man good time must last night ask fontaine sulkily
154,canti wont answer fontaine desperately,impudent ever warrant,wont listen proposition respect sure one upon another subject,fontaine one wild look seem inspire motion deny marsac dart conservatory,marsac completely unnerve manage hide delphine,afraid smallpox story wont judicious subterfuge fontaines reply
155,monsieur duval reflect seriously minutes speak,old duval begin examine room,monsieur duval comtesse de fleury come fontaine,give word monsieur duval nothing like,like proposition shall meet monsieur duval,monsieur duval
156,duval think come house force fontaine give money rather betray presence fiance,least man marry claire worthless fatherinlawpg 88 like prince de landais prey upon letter madame schmid rather baroness schmidmarsac make addition see quickly monsieur duval jump every name,old duval persist motive ridiculously clear every word daughter fond melun placemy daughter could scarcely persuade leave even finer house passy marsac urge apparently unwilling fontaine accept offer mention several countesses duchesses princesses acquaintance think buy place melun,would marry monsieur marsac commit suicide even rather live house delphine scarcely conscious say gleam wicked amusement madame fleurys eye show make dangerous slip,terrible claire succeed capture monsieur duval pg 164 delphines answer artfully contrive dreadful woman succeed marry uncle could longer home opportunity marsac declare spark tenderness,letter prince de landais take landaiss billi assure neither us know man except business wayand write want fontaine marry daughter actually ask money advanceabout six hundred seventyfive francsand take tone person already entitle wretched aristocratic pauper cry old duval indignantly
