,Query,Top-1,Top-2,Top-3,Top-4,Top-5
62,learn project gutenberg literary archive foundation efforts donations help see section 3 4 foundation information page www section 3,1 project gutenberg literary archive foundation foundation pglaf own compilation copyright collection project gutenberg electronic work,please check project gutenberg web page current donation methods address,volunteer financial support provide volunteer assistance need critical reach project gutenbergs goals ensure project gutenberg collection remain freely available generations come,information donations project gutenberg literary archive foundation project gutenberg depend upon cannot survive without widespread public support donations carry mission increase number public domain license work freely distribute machinereadable form accessible widest array equipment include outdated equipment,forty years produce distribute project gutenberg ebooks loose network volunteer support
63,work paragraph tell uncle maurice go traditions family enter trade sort thing,course uncle maurice hasnt die leave fortune let world think see fortunespg 46 make,believe create myselfthat uncle maurice,seem report uncle maurices death come one start story newspapers fortune andpg 170 auguste nerve contradict,however simply force invent biography uncle maurice name date events,explain go traditions family engage trade immensely successful forgive
64,besides would feel sympathy old manhe humble gentle seem grateful even small kindness show pg 157 wreck life fontaines angry reply,fontaine occasionally spasms fear concern ruse twentyfive good appetite enough satisfy love hope friend like marsac one apt whistle jovially,fontaine go mourn youwhich glad see occasion glad,goodhearted creature spite figuratively drag fontaine around hair head wash scrub faithfully marsac could find heart receive coldly,fontaine extremely honestpg 148 simple nature suffer agonies false reputation embarrass manner sickly smile receive compliment achievements take modesty pass therefore modest well gift young man paris,goodi know good yes yes ill forgive marsac hear old duval answer although forgive could tell save life thousand sham man cause innocent little heart ache
65,clock churchtower strike eleveni shall time yet go press,dont let late,might well add name date fulfilment promise,kindly recall date continue madame fleury,well find outnopg 168 matter howand say morning fleury fleury fleury,little one know think hour may bring forth
66,room excessively shabby,didnt mind shabby clothe treat nobly,nonsense,gross exaggeration,sour temper,room shabby ever fontaine dress height although still deepest mourn
67,also invent two rich uncles age decrepit auntall make fontaine heir add marsac uncle maurice nearly go convulsions enjoyment,know near live relative noble fellow engage marry daughter owner house lovely girl mademoiselle claire duval old man seat precious bag knees drink eagerly marsacs every word,endow every virtue man gentleman seem clairvoyant uncle maurice laugh excessivelypg 188 hand smaller roll old bag marsac say well would like nephew less kind nephew less obligation hundred thousand francs mere nestegg,trust get fontaine delight find marsac crazy could nothing hug say marsac frighten begin talk may kill uncles aunts find kill,fact fontaine seem penchantpg 26 mademoiselle claire duval daughter duval rich old brewer niecemademoiselle delphine duvalwho go live say madame fleury like show knowledge acquaintances two young men,think monsieur auguste inform say madame fleury consider relations ah madame widow canpg 62 idea bashfulness young man like fontaine first love affair
68,say fleury know wouldnt glad see tell gentleman,turn eye upon monsieur duval melt glance would put younger man guard,desire settlement question simply avoid scandal dwell upon impossibility feel affection young man fontaine chance sacrifice meet man old enough please old duval begin seriously fear agesixtysevenwas callow immature,language fail hear say quaver voice almost without volition would respectable man madame fleury turn dark eye draw nearer,see try avoid associations affair could become know husband,tell would see monsieur duval today forget
69,marsac delphine leave alone,fontaine marsac leave alone sit look intently simply stun good fortune,leave alone marsac fontaine avoid others gaze say word,delphine must know marsacs turn chagrin,mention stop cry marsac,hear roundabout way dead nothing leave anybody likely sigh marsac
70,handsome fairhaired fellow fiveandtwenty win air world plain first glance grace intelligence man lead affections,fontaine extremely honestpg 148 simple nature suffer agonies false reputation embarrass manner sickly smile receive compliment achievements take modesty pass therefore modest well gift young man paris,fontaine monsieur duval waddle make remarkably good time gentleman years return say impressively take care shepg 126 doesnt bamboozle,clever fellow chuckle uncle maurice delightedly,one look happy face tell uncle maurices fortune make love affair,yes yes say monsieur duval great stroke luck young man hope worthy fontaine reply hop prove entirely worthy uncle maurices goodness
71,days go get great many things like mourn clothe blackedged paper pursue tradesmen desire open account,1 indemnity agree indemnify hold foundation trademark owner agent employee foundation anyone provide copy project gutenberg electronic work accordance agreement volunteer associate production promotion distribution project gutenberg electronic work harmless liability cost expense include legal fee arise directly indirectly follow cause occur distribution project gutenberg work b alteration modification additions deletions project gutenberg work c defect cause,shrink admit necessities ask advance business office newspaper,madame schmid belong large class persons believe man engage form art necessarily loafer,last time saw put determine air little landais assume fierce look ask bill pay,felt humiliate day one young fellows staff mere reporter editorial writerboasted owe tailor alone much owe altogether
72,true widow marsacs response shoot,even use astuteness keep gobble widow,woman marsac love,ladies supper gravely reply marsac,pretty high yes answer marsac remain account widow comtesse de fleury surroundings valuable think perhaps,help marsac bad grace present widow
73,msieu marsac pretty young ladypointing delphineare marry please give wash,know talk assure people fontaines family marry madame fleury rise majestically,glad find home monsieur marsac madame fleurys first word politest greetings exchange,take account daughters fancy friend fontaine good character good birth fortune bring anarrangementyou understandit happiness young people would anything fontaines happiness say marsac,pretty high yes answer marsac remain account widow comtesse de fleury surroundings valuable think perhaps,want marry msieu marsac
74,monsieur duval broad rubicund benevolent conceited true auriferous air belong vulgar rich congratulate fontaine accession fortune,live well enough picturespg 171 play article newspapers fontaines effort cheerful grin say piteous behold,madame fleury rise shake skirt place say see monsieur fontaine illsatisfied visit may pleasure escort carriage ask marsac,marsac declare felt like go mourn grateful uncle maurice do fontaine fontaine perfect truth say think hispg 102 uncle maurice relative world,merely say way make things agreeable madame fleury countess madame fleurys reply one word utter tone concentrate hatred wretch thank get restore longlost husbandpg 181 say marsac injure voice,yes reply marsac modestly report dead determine give fontaine every franc fortune give sir good character besides
75,im count say lady yonder indicate madame fleury always turn nose insignificant would believe,madame fleury shake whole affair nothing,everybody believe defunct uncle maurice fontaine marsac actually seem deceive illusion would talk quite gravely uncle mauricehis taste habit appearance,vexatious lose letter say madame fleury,old duval persist motive ridiculously clear every word daughter fond melun placemy daughter could scarcely persuade leave even finer house passy marsac urge apparently unwilling fontaine accept offer mention several countesses duchesses princesses acquaintance think buy place melun,great heavens whisper old duval one blame monsieur fontaine run away woman scarcely word mouth madame schmid make lunge door fly open knock monsieur duval sprawl
76,marry yet long way monsieur fleury leave alone fontaine remain silent overwhelm various startle incidents befall morning,great heavens whisper old duval one blame monsieur fontaine run away woman scarcely word mouth madame schmid make lunge door fly open knock monsieur duval sprawl,girls faceso fresh lovelyis simply madame fleurys discourage reply business business monsieur marsac must attend marsac keep hear word,fontaine simply declare could face world new character keep close lodgings avoid interrogatories,barely shove scarcely marsac time seat meditative attitude book fontaine old duval enter greet marsacpg 81 could hear madame schmid prance corridor wrath,leave alone marsac fontaine avoid others gaze say word
77,motheaten sofa large rickety cover newspapers implement journalists trade principal article furniture,absence thepg 64 newspaper office cut small salary din favourite restaurant every day smoke best cigars enjoy luxuries often one sou rattle another,sight painters tool violin especially abundance pen ink paper act like red rag bull give excuse want raise tempest,reproach forpg 23 extravagance buy much bread word marsac manage cover dexterously box cigars madame fleury notice,see sofa yes say monsieur duval punch poor old sofa motheaten,shrink admit necessities ask advance business office newspaper
78,let see paragraph ought write marsac seat fontaine hang rapidly write half page rise go cry keep heart old boy,ha fontaines reply depths sofa something groan howl moanedpg 43 know marsac love claire duval devilish madame fleury write promise bagatelle cry marsac still keep pretence laughter,old gentleman think sell mere song never forgive find resold immediately small advance yes yes say fontaine maurepas make little memorandum transaction add readily yes yes,wear look jaunty expectation seem increase startle spectacle himmadame fleury hold monsieur duvals arm old man puff blow smile frown alternate spasms rage delight claire cling fontaine great distress delphine pale defiant stand alone centre group,dear fellow cry marsac tone suppress rapture take contract curse paper,know several men whopg 38 escape live widow fontaine thus urge marsac never resist life look helplessly friend landlady landlady back friend
79,cry monsieur duval swell waistcoat must tell object call see tonight besides congratulate good fortune 82 one sell piece property melun ask dine passy villa soon,anyhow monsieur duval talk whole hour afternoon may depend upon stuff result isnow dont go crazythat hint match claire fontaine fell sofa ecstasy murmur dear darling claire come see soon congratulate,merely say way make things agreeable madame fleury countess madame fleurys reply one word utter tone concentrate hatred wretch thank get restore longlost husbandpg 181 say marsac injure voice,know near live relative noble fellow engage marry daughter owner house lovely girl mademoiselle claire duval old man seat precious bag knees drink eagerly marsacs every word,say grin survey scene minute two quite certain madame carry plan perfectly certain respond monsieur duval pompously find good old duval better husband rascally count marry first bury afterward bury ask marsac pause get whole effect,monsieur fontaine oblige tell porter direct wait awhile case quite ready go monsieur duval object get fontaine way moment door close upon draw chair marsacs begin seriously mop forehead anxiety know monsieur marsac always think extremely well monsieur fontaine come snug fortune mind heif daughter herepg 86 monsieur duval wink marsac grin appreciatively
80,must die need marry,believe fully capable marry,indignation two young ladies seem wholly devise marry,know im old enough father youll marry madame fleury youll find great improvement rascally count marry first may madame duval day like faint shriek burst two girls fontaine dream old man capable folly couldnt repress exclamation 177 however take claires hand say tenderly well dear one thing trust become wife earliest moment possible claire felt moment one earthly dependence cling fontaine weep say marry whenever like cannot never countenance father marriage creature even would marry escape live woman say delphine much agitation,soon marry dismal shake finish sentence,determine course marry
81,meanwhile confident honesty intentions meet debts dunspg 12 difficulties incomparable archness goodhumour,goodhearted creature spite figuratively drag fontaine around hair head wash scrub faithfully marsac could find heart receive coldly,slight tendency clearness must remedied wish really great modern dramatist,fontaine extremely honestpg 148 simple nature suffer agonies false reputation embarrass manner sickly smile receive compliment achievements take modesty pass therefore modest well gift young man paris,madame schmid marsacs delightful impudence way honest heart come great service,fontaine monsieur duval waddle make remarkably good time gentleman years return say impressively take care shepg 126 doesnt bamboozle
82,marsac slip white paper hand turn corner,mirror keep marsac pursue advantage,marsac move toward door pause,marsac turn pale,marsac see keep,marsac take almanac begin turn leave
83,doesnt look acquaintance would much anpg 186 acquisition family say scornfully,never fontaine love admire,wont listen proposition respect sure one upon another subject,lackeys didnt want let suppose well dress ought,fontaine best blood province neither father mother brother sister near relative live,would marry platonist would marry perceive utter baselessness language answer old duval look much relieve hope youll stick
84,think rich old uncle die leave fortuneha,seem report uncle maurices death come one start story newspapers fortune andpg 170 auguste nerve contradict,well glad old uncle cut handsomely monsieur maurepas say marsac severely beg least respect fontaines mourn attire,course uncle maurice hasnt die leave fortune let world think see fortunespg 46 make,apparent absence cash lead believe ever story rich uncle invention marsacs,unclepg 45 maurice die leave fortune
85,dear papa cry one get door wheel come carriage coachman go stable another carriageand monsieur fontaine bring us quite right reply monsieur duval look fondly daughter,old duval persist motive ridiculously clear every word daughter fond melun placemy daughter could scarcely persuade leave even finer house passy marsac urge apparently unwilling fontaine accept offer mention several countesses duchesses princesses acquaintance think buy place melun,terrible claire succeed capture monsieur duval pg 164 delphines answer artfully contrive dreadful woman succeed marry uncle could longer home opportunity marsac declare spark tenderness,letter prince de landais take landaiss billi assure neither us know man except business wayand write want fontaine marry daughter actually ask money advanceabout six hundred seventyfive francsand take tone person already entitle wretched aristocratic pauper cry old duval indignantly,madame uncle uncle let beg give pursuit fontaine,know im old enough father youll marry madame fleury youll find great improvement rascally count marry first may madame duval day like faint shriek burst two girls fontaine dream old man capable folly couldnt repress exclamation 177 however take claires hand say tenderly well dear one thing trust become wife earliest moment possible claire felt moment one earthly dependence cling fontaine weep say marry whenever like cannot never countenance father marriage creature even would marry escape live woman say delphine much agitation
86,afraid two friends conservatory appreciate answer smile,fontaine occasionally spasms fear concern ruse twentyfive good appetite enough satisfy love hope friend like marsac one apt whistle jovially,suppose would let get trap could get give comfort fontaine sublime faith marsacs power well friendship,happy event accomplish marsac promise fontaine rid madame fleury position ask hand claire duval fontaine grow every day passionately love although months since see,hard struggle may meet flatter reception family really near relative feel quite able take care,last diffident woman understand secure jardin des plant madame fleury hear smile play round handsome mouth
87,letter run dear nephew augustethe report reach family dead erroneous,trust get fontaine delight find marsac crazy could nothing hug say marsac frighten begin talk may kill uncles aunts find kill,hear dead old gentleman would please find alive would forgive us anything among first persons hear story madame fleury hardest task marsac stop entresol one morning inquiry whether story true fontaines uncles death,eleven oclock since ten oclock become engage marry find longlost uncle die leave two million francs slight sound cause raise saw letter push door,think monsieur auguste inform say madame fleury consider relations ah madame widow canpg 62 idea bashfulness young man like fontaine first love affair,seem report uncle maurices death come one start story newspapers fortune andpg 170 auguste nerve contradict
88,another glass fontaine another tumbler follow first madame schmid try say stop hug impudent young ladies enjoy excessively second glass wholly dispose madame schmid struggle emotions produce champagne marsacs flattery wrath unpaid bill thrifty alsatian last mean forget,would mention fear fontaine soon madame fleury safely hear marsac contrive raise burst rather hollow hysterical laughter,madame fleury marsacs embarrassment lose although new woman still woman womanly pride impel control slight tremor nerve say voice studiedly cold mere matter business convenience pg 31 give marsac think loophole escape say hurriedly madame innocence regard marriage matter sentiment imagine chagrin though madame fleury smile blush like girl reply well monsieur marsac marsac saw moment pit dig prefer play part poltroon step,old duval persist motive ridiculously clear every word daughter fond melun placemy daughter could scarcely persuade leave even finer house passy marsac urge apparently unwilling fontaine accept offer mention several countesses duchesses princesses acquaintance think buy place melun,say drown say wasnt say wife think say hope keep think hadnt heart betray poor creature say nothing hear new move wifes determine tell around corner wineshop cry drink must come pg 169 two minutes later delphine saw upper window madame schmid parade street marsac gallantly hold yellow parasol red bonnet attend duchess,pg ix list illustrations page extravagant bread ask marsac cheerfully work away old screen frontispiece madame schmid plainly rage 2 madame schmid grow still redder face shorter breath 5 easy enough see master mind 9 madame fleury enter 17 ever think marriage way trouble 25 marsac advance fontaine whisper ear 37 marsac take hand lead madame fleury 39 bold stroke bullfighter assume appearance hale old gentleman sixty 48 pg x fell chair amazement chagrin 50 two young men tear open box 53 hug begin dance wildly 56 dont speak fiance disrespectful manner cry marsac 65 open without word take four bottle champagne 67 saw two poor creatures stand front pastryshop 68 marsac receive much kindness respect bankers daughters 75 madame schmid make dash fontaine collar drag 77 villa say old brewer 83 monsieur duval kneel 89 monsieur duval close one eye playfully poke rib 93 door open admit fontaine two remarkably pretty girls 97 pg xi young people talk gaily together sip champagne 100 hundred thirty thousand francs cry maurepas 108 marsac turn double handspring sofa 110 marsac seize around waist begin waltz furiously 113 creep softly apartment 115 bring delphines golden quite close marsacs brown one consent willingly 121 oh madame fleury cry marsac actually hang 129 madame fleury press handkerchief eye 132 marsac could scarcely restrain shout joy 137 madame fleury begin eagerly search grind letter 139 marsac say tear paper half fontaine dear claire 143 monsieur duvals victoria madame fleury 145 pg xii fontaine sink deep armchair picture misery 149 little old man clutch rusty travellingbag tremble hand 151 let assist say fontaine try take old bag 159 marsac delphine leave alone 161 madame fleury stand petrify moment 175 thing trust say fontaine 177 walk one weazened cadaverous little men ever step 180 madame fleury rush drag unhappy fleury 188 marsac arm around delphines waist 194 pg xiii sprightly romance marsac pg 1 sprightly romance marsac1 1 dramatic right reserve
89,old man get subject daughter vary digressions niece delphine seem amuse much,ever meet old scoundrel side styx promise kick lower regions deprive one hour sweet knowledge delphines love hurrah cry uncle maurice,club dukes marquises sometimes four deep around eye soninlaw widow poor fellow insure life eat whet old duvals desire considerably,know im old enough father youll marry madame fleury youll find great improvement rascally count marry first may madame duval day like faint shriek burst two girls fontaine dream old man capable folly couldnt repress exclamation 177 however take claires hand say tenderly well dear one thing trust become wife earliest moment possible claire felt moment one earthly dependence cling fontaine weep say marry whenever like cannot never countenance father marriage creature even would marry escape live woman say delphine much agitation,course delight see unclepardon mebut man age know better monsieur duval interrupt madame fleury age one greatest charm eye yet coolly continue delphine monsieur fontaines youth objection,trust get fontaine delight find marsac crazy could nothing hug say marsac frighten begin talk may kill uncles aunts find kill
90,fontaine claire exchange laugh glance vary occasional tender pressure hand half listen delphine happy near marsac smilingpg 122 yet cherish bitterness heart profess disdain love,would mention fear fontaine soon madame fleury safely hear marsac contrive raise burst rather hollow hysterical laughter,ha fontaines reply depths sofa something groan howl moanedpg 43 know marsac love claire duval devilish madame fleury write promise bagatelle cry marsac still keep pretence laughter,madame fleury marsacs embarrassment lose although new woman still woman womanly pride impel control slight tremor nerve say voice studiedly cold mere matter business convenience pg 31 give marsac think loophole escape say hurriedly madame innocence regard marriage matter sentiment imagine chagrin though madame fleury smile blush like girl reply well monsieur marsac marsac saw moment pit dig prefer play part poltroon step,fontaine occasionally spasms fear concern ruse twentyfive good appetite enough satisfy love hope friend like marsac one apt whistle jovially,continue smile danger delphine believe talk nothing except folly love love true respond marsac gloomily try drown champagne resentment felt scurvy trick fate play
91,,hear,feel,say,say,ah
